id,text_EN,text_CZ,text,modified,onlyid
"qdesc_sabotazlazni_1SQi","The city council is going to vote soon to choose which baths in Kuttenberg to elevate to City Bathhouse status, which means it won't have to pay high taxes. As might be expected, Betty's Kingfisher bathhouse doesn't have much chance because Adam, her biggest rival, is bribing councillor Jerome Naaz to award him the title.","","","まもなく、クッテンバークの町営浴場を決める投票が開かれる。選ばれた浴場は、町議会から高い税金を免除してもらえる。ビェタのキングフィッシャー浴場が選出される望みは薄い。彼女の最大のライバルであるアダムが、投票のために イェロニーム゠ナース参事会員を買収しているからだ",1
"sabotazla_gathering_info_VOiy","Ask the bathhouse wenches about Councillor Naaz.","","","浴場婦たちにナース参事会員について尋ねる",1
"sabotazla_p2_vysyp_stenic_gGll","Pour the fleas into Naaz's laundry chest unobserved. ","","","ナースの洗濯物の箱にこっそりノミを入れる ",1
"sabotazla_zeptej_se_mani_i6cD","Ask Mary about Councillor Naaz.","","","マーニャにナース参事会員について尋ねる",1
"wine_videli_me_pri_redeni_Zjrg","Kurva! I was seen pouring the brew into the cask, so there's no chance they'll serve this wine to Naaz now. I have to find another way to spoil his visit, otherwise the Kingfisher baths will go down the drain.","","","ちくしょう! 煎じ薬を樽に注いでいるところを見られてしまったので、このワインがナースに供されることはもうない。別の方法で奴の訪問を台無しにしなければ。さもないと浴場〈カワセミのそばで〉はお流れになる",1
"wine_vino_jsem_naredil_do_vY9c","I found Naaz's cask and poured Chamomile decoction into it. Let's hope the Councillor drinks a lot and feels sick as a dog.","","","ナースの酒樽を見つけて、中にカモミール液を注いだ。参事会員がそいつを平らげて、犬のように体調を崩すのを祈ろう",1
"zeptej_se_lazebnice_mi_re_GpbW","One of the bathhouse girls told me to go and see some Mary. It seems she might know something about the councillor. So I'll see if I can find her.","","","ある浴場婦から、マーニャという女と話すよう勧められた。参事会員について何か知っているそうだ。そのマーニャを探してみよう",1
"questionm_p_mari_mi_rekla_1hda","I overheard that Goatskin is friends with someone called Lousy Mary. At first, she didn't want to get her beloved into trouble, but in the end I persuaded her to tell me where Goatskin was hiding. Behind the bathhouse there's a yard that leads to a lane. At the end of this lane there's a barn behind a wall. The barn has a hole in its gable. And that's where Goatskin is hiding.","","","〈山羊皮〉は〈辛辣なマージー〉という女と親しいらしい。初めこそ、恋人を庇おうとした彼女だったが、最終的には〈山羊皮〉の隠れ場所を教えてくれた。浴場の裏手の庭から通りに出て、そこを進むと突き当たりにたたずんでいる壁の後ろに納屋がある。その納屋の切妻屋根には穴が開いており、〈山羊皮〉はそこに隠れている",1
"questionm_p_zjisti_co_o_k_eRG5","I found out that Goatskin is friends with a bathhouse wench called Mary. Maybe she can lead me to him.","","","〈山羊皮〉はマージーという名の浴場婦と親しいそうだ。彼女なら奴の居場所がわかるかもしれない",1
"questionm_p_z_mari_jsem_o_UFGE","I overheard that Goatskin is friends with a certain Lousy Mary. She didn't want to tell me anything, but it was pretty suspicious how she tried to wriggle out of talking to me.","","","〈山羊皮〉は〈辛辣なマージー〉という女と親しいそうだ。会ってはみたが、彼女は何も話したがらない。しかし、必死にはぐらかそうとする姿はかなり怪しかった",1
"qname_sesivanitonici_aSkR","Striped Tonies","","","〈縞模様のトニーク団〉",1
"prijd_zit_kdyz_jsem_rano__s7QU","The miners' tradition of consecrating a ceremonial standard always precedes the annual shooting competition. I promised foreman Vlach to help the miners with their traditional procession. Early in the morning I was supposed to meet my friends the Striped Tonies at the Church of St. John the Baptist in Hoprink. ","","","儀式用の団章旗を聖別するという鉱夫たちの伝統行事では、必ず毎年恒例の射撃大会前に行われる。俺はヴラヒ親方に鉱夫たちの行進を手伝うと約束した。俺は早朝に、フメルナー通りの洗礼者ヨハネ教会で〈縞模様のトニーク団〉の仲間たちと会う予定だ ",1
"cest_francek_houby_na_sac_hUWz","Nee pit for him. He's like te break 'is arum with a kevel...","","","坑道は無理だろ きっと「ケヴェル」で腕を折っちまうぞ…",1
"havi_sesivany__doprdele_c_sYCY","It's not my fucking fault that Preng fucked us over. He stole the stang from you!","","","プランクにハメられたのは俺のせいじゃない お前が団章旗を盗られたからだ!",1
"nada_jorg_prank_ah_ich_sc_havN","Ah, ich schlage dir die Fresse ein! ","","","イッヒ シュラーゲ ディア ディエ フレッセ アイン (顔面に一発お見舞いしてやる)!",1
"najdi_pre_musim_se_podiva_CO8S","I've got to track down the merchant Hensel. Preng told me he left with a wagon for Prague a while ago. The heavy goods wagon won't be moving fast and can't have got too far. Being a merchant, Hensel won't head straight for Prague, so I should catch up with him before he reaches Bylany.","","","ヘンスルという商人を探す。プランクによれば、ヘンスルはしばらく前にプラハへ向けて馬車で出発した。その荷馬車には重い荷物が積まれているため動きが遅く、まだ遠くへは行っていない。しかも商人なら、真っすぐプラハへは行かないだろう。ビラニへつく前に追いつけるはずだ",1
"promluv_s_mrtvy_prank_mi__bR3Z","Preng can't tell me anything now he's dead.","","","プランクが死んだため、これ以上何も聞き出せない",1
"anto_anton_kas_ale_vopatr_7hVM","But careful, I think Else's a little jealous of Tess because of me, so dinna tell her I sent you.","","","だが  エルゼは俺のことでレージに少し嫉妬して るらしい  だから俺の名前は出すなよ",1
"anto_anton_kas_chapu_rad__njse","I understand. If you bring that gift, there'll be a foy in it for ye. I want to make Tess happy.","","","もちろん  贈り物を持ってきてくれたら 報酬は渡す  俺はレージを喜ばせたいんだ",1
"anto_anton_kas_no_jo_rezy_znux","Wey aye… that Tess of mine is a wonderful lass.","","","まったくだ…  俺のレージは最高の女だからな",1
"anto_anton_kas_rezy_rezy__IVP6","Tess, Tess, with yer lovely lips, and yer lovely pair of ti-i.. &lt;hic&gt;.","","","レージ レージ 素敵な唇 君のきれいなおっぱ…",1
"anto_francek__jo_za_to_ty_zVJK","Nae fash aboot me… When Tess sees you've been brawlin' she's going to pull your liggies up to your heed.","","","俺のことはいい…  あんたは喧嘩したことがレージに バレたら  股間を蹴り上げられちまうぞ",1
"anto_francek_no_tak_anton_Vohm","Well Anton, what exactly does Tess like?","","","で アントン レージは何が好きなんだ？",1
"anto_francek_ostatne_nema_bpdh","But you're worried, Anton, reet? Since yer meeting yer Tess tonight, eh?","","","今夜はレージとのデートがあるから心配なんだろ？ アントン",1
"anto_henry_dojdu_rezy_pro_drfB","I'll go and get Tess a gift and be right back.","","","レージへの贈り物を手に入れて  すぐ戻るよ",1
"anto_henry_kde_bydli_ta_e_tzeR","What kind of perfume does Tess like?","","","レージはどんな香水が好きなんだ？",1
"anto_henry_nejaky_darek_s_xFum","What does your Tess actually like, Anton?","","","レージはどんなものが好きなんだ？",1
"fran_anton_kas_ho_ho_ho_j_Ogqx","Ho ho ho… I'm going to sing! I'll serenade Tess about how much I love her.","","","よおし…  歌うぞ！  俺のこの愛が レージのもとに届くように",1
"fran_anton_kas_placeholder_RfrQ","Ah, Tess, Tess, the lass of my heart, the bonniest lassie in all of these parts! &lt;hic&gt;","","","ああ  レージ  レージ  俺のレージ  この土地一の 器量よし！",1
"opil_anton_kas_ja_ti_rekn_dG79","Let me tell ye, marra, I love you! I love Tess more but &lt;hic&gt;…","","","言わせてくれ  お前が好きだ！  レージは もっと好きだが…",1
"poke_francek_anton_neni_c_rZqi","Anton's not poor, he inherited a house from his father, who arranged the marriage years ago with Tess's pa, Linhart. ","","","アントンは貧乏じゃない  父親から受け継いだ 家がある  アントンの父とレージの父リンハルトは 子どもたちを婚約させたんだ",1
"poke_francek_chudak_ceka__FmOK","The poor fellow has to wait until ginger fucker gans to hell, only in the meantime Linhart's looking for a new bridegroom for Tess.","","","気の毒に  あいつはあの赤毛のクソ野郎が地獄に 行くまで待たなきゃならない  だがリンハルトは レージの新しい花婿を探し始めてる",1
"poke_francek_jednoduse_je_t4aO","Tess's father is a reputable cobbler and Anton's just a young yacker…","","","レージの父親は立派な靴屋で  アントンはただの 若い鉱夫だ…",1
"poke_henry_hele_jak_je_to_43yY","Look, what's really going on with Anton and Tess?","","","なあ  アントンとレージの仲は実際どうなんだ？",1
"pris_francek_pane_farar_v_w18b","Father, Anton's in a bad way because they don't want to give him Tess, the cobbler's girl.","","","神父様  靴屋の娘のレージとすんなり結婚させて もらえてれば  アントンはこんな風には…",1
"rezy_else_ach_tak_chapu_r_ZUCi","Ach so, ich verstehe. Tess will get a gift, your friend will have a chance, and that idiot Anton will stay single.","","","そういうことね  レージは贈り物をもらえる あなたのお友達にはチャンス到来  で バカなアントンは独身のまま",1
"rezy_henry_ne_jde_o_anton_4LaX","He's the one who wants to make Tess happy with a nice gift.","","","レージに素敵な贈り物をしたがってる男だ",1
"rezy_henry_prave_a_rezy_b_6TOb","Exactly, and Tess would be happy if she got a flask of your wonderful perfume.","","","そのとおりだ  そしてあんたの素敵な香水を もらえたら  レージは喜ぶ",1
"rezy_henry_zamiloval_se_d_ishj","He's in love with your friend Tess.","","","彼は  レージに恋をしてる",1
"ui_anton_s_f_cerstvy_kytky_zs1j","What about giving Tess fresh flowers?","","","レージに花を贈ったらどうだ？",1
"ui_anton_s_f_co_ma_roza_r_FqNO","What would Tess like, Anton?","","","レージの好みは何だ？ アントン",1
"ui_anton_s_f_prinesu_darek_Cg5c","I'll bring a gift for Tess.","","","レージへの贈り物を持ってくる",1
"ui_anton_s_f_seq6_ZeOy","What kind of perfume would Tess want?","","","レージはどんな香水が欲しいんだ？",1
"ui_pokec_s_f_anton_a_rezy_xvji","Anton and Tess","","","アントンとレージ",1
"ui_rezyna_ka_seq13_PhkY","He's in love with Tess.","","","彼はレージに恋してる",1
"ui_zpatky_v__a_co_rezy_NL1o","What does that have to do with Tess?","","","それとレージに何の関係があるんだ？",1
"vlac_predak_vl_hen_tam_kl_gQMC","He stumbled upon Tess and Anton and our blockhead takes off running and hurts his arm. ","","","そこをレージとアントンに鉢合わせ  うちの間抜けは 焦って逃げた拍子に腕を痛めた",1
"zpat_francek_anton_se_bal_kDHH","Anton was afraid you weren't coming and that Tess would dump him tonight. So he had a few beers…","","","アントンはあんたが戻らず  今夜レージに 振られるんじゃないかと心配してた それでビールを飲んで…",1
"zpat_francek_co_furt_ja_t_JBLl","Don't look at me! It's Anton who was moaning about not being able to marry Tess.","","","俺に当たるなよ！  レージと結婚できなくて グチグチ言ってるのはアントンだ",1
"zpat_francek_hele_von_to__1EDK","Hey, Anton doesn't have an easy life, and Tess is his sole source of joy in this world.","","","いいか  アントンは苦労人だ  レージはそんな あいつの唯一の生きがいなんだ",1
"zpat_francek_jeji_otec_jo_pOwp","Her father Linhart is a well respected burgher and has already betrothed Tess to Anton.","","","彼女の父親のリンハルトは高名な市民でな すでにレージとアントンを婚約させてるんだが…",1
"zpat_henry_ano_tady_ho_ma_DUTt","Yes, here it is. Tess should like it.","","","ああ  持ってきたぞ  レージも気に入るだろう",1
"zpat_henry_a_rezy_bwaz","And what does that have to do with Tess?","","","それとレージに何の関係が？",1
"jdi_pro_k_mam_cerstve_kve_Co93","Finding fresh roses for Tess in Kuttenberg was truly no simple task. This mining town isn't overflowing with gardens in bloom, but in the Cobblers' Quarter I found a hidden garden and picked some flowers there.","","","レージのために花盛りのバラを探さなくてはならないが、クッテンベルクで見つけるのは決して簡単なことではない。この採鉱が盛んな街に花が咲き誇る庭園があるとは思えなかったが、靴屋の区画に秘密の庭園があり、そこで花を摘むことができた",1
"jdi_pro_k_mam_sehnat_kvet_yYMn","I have to find red roses for Tess. Roses are rare, and there aren't many gardens in a mining town like Kuttenberg, but I hear there's an abandoned garden in the Cobbler's Quarter where these roses grow.","","","テスのために赤いバラを見つけなければならない。バラは珍しく、クッテンベルクのように採鉱が盛んな街には庭園が少ない。だが、靴屋の区画にバラが咲いている廃庭園があると聞いた",1
"jdi_pro_p_mam_sehnat_vona_uO5u","I have to get some perfume from Tess's friend Elsa, who is the daughter of Johlin the cobbler, who has a house on the Upper Market near the crossroads with Merchants' Street.","","","レージの友達のエルセから香水を手に入れなければならない。彼女は靴屋ヨフリンの娘で、上市場の商人通りにある十字路辺りに住んでいる",1
"promluv_s_nasel_jsem_dare_XgN0","I found a gift for Anton's dear Tess. I have to get back to the tavern before Franzi does something stupid again.","","","アントンの想い人、レージへの贈り物を調達した。フランツェクがまたバカなことをしでかす前に酒場に戻らないと",1
"promluv_s_po_navratu_do_h_3HuN","Upon returning to the tavern an interesting surprise awaited me. I never thought Anton would manage to get drunk from grief before I returned with the gift for Tess.","","","酒場に戻ると意外な展開が待ち受けていた。まさかテレージの贈り物を渡す前に、アントンが悲しみに暮れて酔いつぶれてしまうとは",1
"sesivanit_jdi_pro_kvetiny_ge1B","Pick flowers for Tess.","","","レージのために花を摘む",1
"zeptej_se_z_poulicni_rvac_7iDq","Fortunately, we got out of the brawl with the Saints with our honour intact. Everything would have been fine had Anton not thought about his dear Tess and her birthday over a tankard of ale.","","","幸い、俺たちは汚名を被る前にセインツとの乱闘を脱出した。アントンが愛するレージの誕生日を考えるあまり、飲み過ぎたりしなければ… こんなことにはならなかったのに",1
"zitra_ran_predak_vlach_by_6WRB","Foreman Vlach was quite uneasy this morning. Anton's romantic rendez-vous with Tess ended most ignominiously for the miners' champion shooter! When running away from Master Linhart, Anton hurt his arm and could not compete in the shooting competition.","","","今朝のヴラヒ親方はかなり困った様子だった。射撃の名手アントンが、恋人レージとのデートの際に非常に残念な失敗をやらかしたのだ! リンハルト親方に見つかって逃げ出す時に、腕を怪我してしまったのである。これによりアントンは射撃大会に参加することができなくなった",1
"sabotazla_councilman_5typ","Gain Councillor Tuchmacher's support.","","","フィフレ参事会員の支持を取り付ける",1
"qdesc_strasidlo_XcfF","Voyta’s opus magnum is supposed to be a painting for the altar at Sedletz. However, after many years, his old friend Bellissimo reappeared in Kuttenberg, someone with whom he has unresolved issues from the past. Bellissimo is also interested in the project and seems to have struck a deal with the abbot to his own advantage. This is bad news for Voyta, who believed the commission was secure. How can Bellissimo be deterred? And how did he manage to get the commission?  ","","","セドレツの祭壇に飾られる絵画は、ヴォイチェフの最高傑作になるはずだった。しかし、長い年月を経て、彼の旧友ベリッシモがクッテンベルクに舞い戻ってきた。旧友といっても、ヴォイチェフとの間に何かしらしこりがある男らしい。そのベリッシモもこの話に興味を抱き、修道院長とかけあって取引をまとめてしまったという。仕事は安泰だと思っていたヴォイチェフにとって、これは大きすぎる痛手だ。果たして、ベリッシモを思い止まらせることはできるだろうか？そもそも彼はどうやって話を取りつけたのだろう？",1
"prohledej_krasek_ma_prona_OSPH","Bellissimo’s room should be on the upper floor of the baths. I’ll go there to see if I can find out how he managed to steal Voyta’s commission. Apparently, the room can be identified by its smell – it reeks of alcohol.  ","","","ベリッシモの部屋は浴場の上の階にあるはずだ。中に入って、どうやってヴォイチェフの仕事を横取りしたのか調べよう。部屋は匂いでわかるだろう。かなり酒臭いらしい",1
"nenapadne_vedle_nazovy_ka_PVwc","Next to Naaz s tub is his laundry chest with clean clothes, and now with a whole load of fleas. This will be an experience he will never forget!","","","ナースの浴槽の隣にはきれいな服の入った収納箱があるが、今は大量のノミだらけだ。きっと忘れない経験になるだろう!",1
"nenapadne_nenapadne_vysyp_Plp5","I ll pour the little buggers into the basket of clean laundry beside Naaz s tub when nobody s looking. And then I ll just let them do their thing.","","","人目を盗んで、ナースの浴槽付近にある洗濯済みの服の籠に、こいつを注いでやろう。あとは仕上げをご覧あれだ",1
"nasleduj__zastupce_mestan_K1Vk","The representative of burghers, Jerome Naaz, then welcomed us to the Italian Court and led us to the Mint and to the Great Hall. Godwin and Janosh headed to the Church Council. Meanwhile, the rest of the retinue was to make themselves at home in the kitchen…","","","市民代表の イェロニーム゠ナースが俺たちをイタリア宮に歓迎し、造幣局と大広間を案内してくれた。ボフタとヤーノシュは教会会議へ。一方、他の従者は厨房へと向かった…",1